{
  "schema": 1,
  "id": "EQ-2025-07-29-001",
  "hazard": "EQ",
  "identity": {
    "glide": null,
    "usgs_ids": ["us6000qw60", "usauto6000qw60", "at00szymte"],
    "gdacs_event_id": 1441382,
    "gdacs_episode_id": 1602103,
    "reliefweb_ids": []
  },
  "times": {
    "origin_utc": "2025-07-29T23:24:52+00:00",
    "first_seen_utc": "2025-07-29T23:32:10+00:00",
    "last_changed_utc": "2025-07-30T00:12:41+00:00"
  },
  "geo": {
    "lat": 52.51,
    "lon": 160.32,
    "country_iso3": "RUS",
    "place_name": "Off the east coast of Kamchatka, Russia"
  },
  "severity": {
    "gdacs_alertlevel": "Red",
    "gdacs_episode_alertlevel": "Red",
    "pager_alert": "orange",
    "usgs_sig": 2908,
    "magnitude": 8.8,
    "depth_km": 19.5
  },
  "impact": [
    {
      "metric": "population exposed to strong shaking (MMI VI+)",
      "value": 129000,
      "label": "estimated",
      "source": "USGS PAGER"
    },
    {
      "metric": "tsunami waves observed at Severo-Kurilsk",
      "value": "3-4 m",
      "label": "reported",
      "source": "regional authorities via GDACS episode text"
    }
  ],
  "merge": {
    "tier": 2,
    "confidence": "high",
    "delta_t_min": 1.2,
    "delta_km": 14.0
  },
  "links": { "reliefweb_umbrellas": [] },
  "change": {
    "status": "ESCALATED",
    "summary": "gdacs alertlevel Orange→Red; magnitude 8.0→8.8",
    "since_utc": "2025-07-29T23:47:03+00:00"
  },
  "sources": [
    {
      "feed": "usgs",
      "fetched_utc": "2025-07-30T00:29:31+00:00",
      "record": {
        "id": "us6000qw60",
        "title": "M 8.8 - 2025 Kamchatka Peninsula, Russia Earthquake",
        "status": "reviewed",
        "tsunami": 1
      }
    },
    {
      "feed": "gdacs",
      "fetched_utc": "2025-07-30T00:29:12+00:00",
      "record": {
        "eventid": 1441382,
        "name": "Earthquake in Russia",
        "alertlevel": "Red",
        "source": "NEIC"
      }
    }
  ]
}
